{
  "instanceId": "comparison-grid.defaults",
  "theme": {},
  "global": { "speed": 1.0, "delayOffset": 0, "easing": "ease-out-cubic" },
  "elements": [{ "id": "cell-0-0", "text": "Option" }],
  "extras": {
    "rows": 3,
    "cols": 3,
    "cells": [
      ["Option", "Speed", "Cost"],
      ["A",      "Fast",  "$$$"],
      ["B",      "Slow",  "$"]
    ],
    "eyebrow": null,
    "title": null,
    "subtitle": null,
    "sequenceOrder": "diagonal",
    "flipDurationSeconds": 0.42,
    "staggerSeconds": 0.07,
    "cellGapPx": 8,
    "cellBackground": null,
    "cellBorder": null,
    "cellRadiusPx": 10,
    "cellPaddingPx": 24,
    "headerCellPaddingPx": 16,
    "headerRowRatio": 0.7,
    "flipEasing": "ease-out-cubic",
    "headerRow": true,
    "headerEmphasis": "none",
    "accentLandFlash": true,
    "rowSeparators": false,
    "winnerRow": null,
    "winnerRowDurationFrames": 14,
    "cellBorderless": false,
    "postFlipHoldFrames": 18,
    "containerWidthPct": 88,
    "containerHeightPct": 64,
    "columnWidths": null,
    "columnAlign": null
  }
}